[
  {
    "age_band": "2-5",
    "child_prompt_ref": "mission.mission_cushion_nest.child_prompt",
    "cooperative_only": true,
    "created_by": "phase0-architect",
    "estimated_minutes": 3,
    "id": "mission-cushion-nest",
    "locale": "en-US",
    "notes_author": "DEMO cooperative mission with all 3 alternative levels (primary -> household alt -> body/pretend fallback).",
    "objects": [
      {
        "alternative_object_id": "folded-towel",
        "alternative_picture_ref": "folded-towel",
        "fallback_body_action_id": "pretend-pillow-hands",
        "fallback_body_picture_ref": "pretend-pillow-hands",
        "label_ref": "item.soft_cushion.label",
        "object_id": "soft-cushion",
        "picture_ref": "soft-cushion"
      },
      {
        "alternative_object_id": "folded-towel",
        "alternative_picture_ref": "folded-towel",
        "fallback_body_action_id": "pretend-pillow-hands",
        "fallback_body_picture_ref": "pretend-pillow-hands",
        "label_ref": "item.cozy_blanket.label",
        "object_id": "cozy-blanket",
        "picture_ref": "cozy-blanket"
      }
    ],
    "parent_gate_required": true,
    "parent_precheck": {
      "adult_present_check": true,
      "prompt_ref": "mission.mission_cushion_nest.precheck",
      "required": true,
      "space_clear_check": true
    },
    "parent_script_ref": "mission.mission_cushion_nest.parent_script",
    "record_type": "mission",
    "return_ritual_ref": "mission.mission_cushion_nest.return_ritual",
    "reviewed_by": "phase0-reviewer",
    "safety_notes_refs": [
      "mission.mission_cushion_nest.safety_1"
    ],
    "skill_id": "everyday-words-entry",
    "song_fallback_rule": "use_lesson_song_template",
    "song_id": "cozy-chime-song",
    "status": "draft",
    "tags": [
      "demo",
      "cooperative",
      "device_down"
    ],
    "team_goal_ref": "mission.mission_cushion_nest.team_goal",
    "title_ref": "mission.mission_cushion_nest.title",
    "version": "0.1.0"
  }
]
